{
  "$schema": "http://json-schema.org/draft-07/schema#",
  "type": "object",
  "required": ["name", "contact", "summary", "education", "experience", "skills"],
  "properties": {
    "name": { "type": "string" },
    "headline": { "type": "string" },
    "profile_picture": { "type": "string" },
    "contact": {
      "type": "object",
      "required": ["email", "phone", "address"],
      "properties": {
        "email": { "type": "string", "format": "email" },
        "phone": { "type": "string" },
        "phone_secondary": { "type": "string" },
        "address": { "type": "string" },
        "linkedin": { "type": "string" }
      }
    },
    "summary": { "type": "string" },
    "education": {
      "type": "array",
      "items": {
        "type": "object",
        "required": ["degree", "institution", "year"],
        "properties": {
          "degree": { "type": "string" },
          "institution": { "type": "string" },
          "year": { "type": "string" },
          "logo": { "type": "string" },
          "website": { "type": "string" }
        }
      }
    },
    "experience": {
      "type": "array",
      "items": {
        "type": "object",
        "oneOf": [
          {
            "required": ["company", "roles"],
            "properties": {
              "company": { "type": "string" },
              "company_image": { "type": "string" },
              "company_website": { "type": ["string", "null"] },
              "roles": {
                "type": "array",
                "items": {
                  "type": "object",
                  "required": ["title", "start", "end", "description"],
                  "properties": {
                    "title": { "type": "string" },
                    "location": { "type": "string" },
                    "start": { "type": "string" },
                    "end": { "type": "string" },
                    "description": { "type": "string" },
                    "highlights": {
                      "type": "array",
                      "items": { "type": "string" }
                    },
                    "skills": {
                      "type": "array",
                      "items": { "type": "string" }
                    }
                  }
                }
              }
            }
          },
          {
            "required": ["title", "company", "start", "end", "description"],
            "properties": {
              "title": { "type": "string" },
              "company": { "type": "string" },
              "location": { "type": "string" },
              "start": { "type": "string" },
              "end": { "type": "string" },
              "description": { "type": "string" },
              "highlights": {
                "type": "array",
                "items": { "type": "string" }
              },
              "skills": {
                "type": "array",
                "items": { "type": "string" }
              },
              "company_image": { "type": "string" },
              "company_website": { "type": ["string", "null"] }
            }
          }
        ]
      }
    },
    "skills": {
      "type": "array",
      "items": { "type": "string" }
    },
    "certifications": {
      "type": "array",
      "items": {
        "type": "object",
        "required": ["name", "issuer"],
        "properties": {
          "name": { "type": "string" },
          "issuer": { "type": "string" },
          "link": { "type": "string" }
        }
      }
    },
    "volunteer": {
      "type": "array",
      "items": {
        "type": "object",
        "required": ["role", "organization", "year", "description"],
        "properties": {
          "role": { "type": "string" },
          "organization": { "type": "string" },
          "year": { "type": "string" },
          "description": { "type": "string" }
        }
      }
    }
  }
}
