{
  "name": "Feroz Ahmmed",
  "profile_picture": "profile.jpg",
  "contact": {
    "email": "froghramar@gmail.com",
    "phone": "+880 15214 98748",
    "phone_secondary": "+880 13220 72332",
    "address": "Thakurgaon, Rangpur Division, Bangladesh",
    "linkedin": "https://linkedin.com/in/froghramar"
  },
  "summary": "I'm a seasoned web application developer with a proven track record of delivering high-impact solutions across the entire technology stack. I specialize in .NET Core and C# development, with deep expertise in building scalable microservices using modern architectural patterns. My commitment to excellence is backed by formal education from the University of Dhaka and industry-recognized Microsoft certifications. I thrive in fast-paced environments where I can make an immediate impact, mentor others, and continuously push the boundaries of what's possible with modern cloud technologies.",
  "education": [
    {
      "degree": "Bachelor of Science in Software Engineering",
      "institution": "University of Dhaka",
      "year": "2017",
      "logo": "assets/du_logo.svg",
      "website": "https://www.du.ac.bd"
    },
    {
      "degree": "Higher Secondary Certificate (HSC)",
      "institution": "Pirganj Govt. College",
      "year": "2013",
      "logo": "assets/pirganj_govt_college_logo.jpg",
      "website": "https://www.pirganjgc.edu.bd"
    },
    {
      "degree": "Secondary School Certificate (SSC)",
      "institution": "Pirganj Pilot High School",
      "year": "2011",
      "logo": "assets/pirganj_pilot_school.jpg",
      "website": "https://www.sohopathi.com/pirganj-pilot-high-school"
    }
  ],
  "experience": [
    {
      "title": "Full Stack Developer",
      "company": "Duotronic",
      "location": "Dhaka, Bangladesh (Remote)",
      "employment_type": "Full-time",
      "start": "2025-12",
      "end": "2026-04",
      "description": "Develops a full-stack TypeScript platform for branchable cloud infrastructure and automated orchestration using Node.js and Koa.js.",
      "highlights": [
        "Developed a full-stack TypeScript platform for branchable cloud infrastructure, enabling Git-based version control for entire application environments.",
        "Engineered scalable multi-tenant backend services and orchestration layers using a modern Node.js and Koa.js stack.",
        "Built high-performance web systems and interactive interfaces to manage and deliver structured application data efficiently.",
        "Architected a unified CLI and API control plane to automate complex deployment workflows and streamline system management."
      ],
      "skills": ["Node.js", "Koa.js", "TypeScript", "React", "PostgreSQL"],
      "company_image": "assets/duotronic_logo.jpeg",
      "company_website": "https://duotronic.ai"
    },
    {
      "title": ".NET Developer",
      "company": "Toptal",
      "location": "Chicago, Illinois, United States (Remote)",
      "employment_type": "Contract",
      "start": "2022-03",
      "end": "2025-06",
      "description": "Contributed to the modernization of a mission-critical legacy application for a Fortune 100 North American construction equipment manufacturer.",
      "highlights": [
        "Migrated from .NET Framework to .NET Core.",
        "Redesigned and optimized the database schema to align with evolving business requirements.",
        "Developed high-performance solutions for data-intensive operations.",
        "Authored complex SQL Server stored procedures to optimize data import and ingestion.",
        "Implemented performance tuning strategies including query optimization, indexing, and caching.",
        "Collaborated with business stakeholders and subject matter experts.",
        "Conducted thorough performance testing and profiling.",
        "Participated in code reviews and knowledge-sharing sessions."
      ],
      "skills": [".NET", "Entity Framework", "SQL Server", "Performance Tuning"],
      "company_image": "assets/toptal_logo.jpg",
      "company_website": "https://www.toptal.com/resume/feroz-ahmmed"
    },
    {
      "company": "SELISE Group",
      "employment_type": "Full-time",
      "company_image": "assets/selise_logo.jpg",
      "company_website": "https://selisegroup.com",
      "roles": [
        {
          "title": "Senior .NET Developer",
          "location": "Dhaka, Bangladesh (Remote)",
          "start": "2021-05",
          "end": "2022-05",
          "description": "Led and mentored a team of 10 developers, providing technical guidance, code reviews, and best practices.",
          "highlights": [
            "Onboarded and trained new team members on microservices architecture.",
            "Spearheaded migration of multiple microservices to newer .NET versions.",
            "Implemented comprehensive monitoring and observability solutions.",
            "Established logging and monitoring best practices.",
            "Architected and maintained distributed tracing and centralized logging infrastructure.",
            "Collaborated with stakeholders to define technical roadmaps.",
            "Conducted technical training sessions and knowledge-sharing workshops."
          ],
          "skills": [".NET", "Azure DevOps", "Microservices", "Application Insights", "ElasticSearch", "Kibana", "Seq"]
        },
        {
          "title": ".NET Developer",
          "location": "Dhaka, Bangladesh (Hybrid)",
          "start": "2019-04",
          "end": "2021-05",
          "description": "Served as the primary developer, leading the development of a significant portion of the application using C# and .NET Core.",
          "highlights": [
            "Designed and developed microservices architecture (DDD, CQRS, Event Sourcing).",
            "Implemented serverless solutions using Azure Functions.",
            "Containerized microservices with Docker and orchestrated deployments using Kubernetes.",
            "Built and maintained CI/CD pipelines using Azure DevOps.",
            "Leveraged Azure CosmosDB as the event store and data persistence layer.",
            "Implemented event-driven architecture for asynchronous communication.",
            "Configured Kubernetes deployments with auto-scaling policies and health checks."
          ],
          "skills": [".NET Core", "Azure Functions", "Docker", "Kubernetes", "CosmosDB", "CI/CD"]
        }
      ]
    },
    {
      "title": "Full Stack Developer",
      "company": "Loence Solution",
      "location": "Dhaka, Bangladesh",
      "employment_type": "Full-time",
      "start": "2019-01",
      "end": "2019-03",
      "description": "Contributed to the development of a comprehensive ERP software solution at a startup.",
      "highlights": [
        "Worked across the full stack with Node.js, TypeScript, Angular, and MongoDB.",
        "Led development efforts on the Human Resource Management (HRM) module.",
        "Built RESTful APIs using Node.js and TypeScript.",
        "Designed and implemented responsive Angular components.",
        "Architected MongoDB database schemas.",
        "Collaborated closely with stakeholders in a fast-paced startup environment."
      ],
      "skills": ["Node.js", "TypeScript", "Angular", "MongoDB"],
      "company_image": "assets/loence_logo.jpg",
      "company_website": null
    },
    {
      "title": "Angular Developer",
      "company": "SELISE Group",
      "location": "Dhaka, Bangladesh",
      "employment_type": "Full-time",
      "start": "2018-01",
      "end": "2019-01",
      "description": "Developed a comprehensive project management tool using TypeScript and Angular.",
      "highlights": [
        "Designed and implemented interactive data visualizations and charts.",
        "Built scalable front-end architecture with Angular components.",
        "Created dynamic dashboards for project analytics.",
        "Collaborated with team members to gather requirements and iterate on UI/UX designs.",
        "Utilized TypeScript to write type-safe, maintainable code."
      ],
      "skills": ["Angular", "TypeScript", "MongoDB", "Data Visualization"],
      "company_image": "assets/selise_logo.jpg",
      "company_website": "https://selisegroup.com"
    },
    {
      "title": "AngularJS Developer",
      "company": "SELISE Group",
      "location": "Dhaka, Bangladesh",
      "employment_type": "Internship",
      "start": "2017-01",
      "end": "2017-06",
      "description": "Developed responsive and dynamic user interfaces using JavaScript and AngularJS.",
      "highlights": [
        "Built reusable components and implemented complex front-end functionality.",
        "Collaborated with senior developers and cross-functional teams.",
        "Debugged and optimized existing code.",
        "Gained hands-on experience with modern web development practices."
      ],
      "skills": ["JavaScript", "AngularJS"],
      "company_image": "assets/selise_logo.jpg",
      "company_website": "https://selisegroup.com"
    }
  ],
  "skills": [
    ".NET Core", "C#", "Microsoft Azure", "Angular", "LangChain", "Entity Framework", "SQL Server", "Docker", "Kubernetes", "Azure DevOps", "CosmosDB", "CI/CD", "TypeScript", "Node.js", "MongoDB", "Data Visualization", "JavaScript", "AngularJS"
  ],
  "certifications": [
    {
      "name": "Microsoft Certified: Azure Administrator Associate",
      "issuer": "Microsoft",
      "link": "https://learn.microsoft.com/api/credentials/share/en-us/FerozAhmmed-2789/D1E5CEC50F99C48A?sharingId=794F337D9A72D0A7"
    },
    {
      "name": "Microsoft Certified: Azure Fundamentals",
      "issuer": "Microsoft",
      "link": "https://learn.microsoft.com/api/credentials/share/en-us/FerozAhmmed-2789/9AEBF90A39232074?sharingId=794F337D9A72D0A7"
    },
    {
      "name": "Microsoft Certified: Azure Developer Associate",
      "issuer": "Microsoft",